{
  "$schema": "https://json-schema.org/draft/2020-12/schema",
  "$id": "lite.schema.json",
  "title": "ClawBench-Lite Manifest",
  "description": "Schema for ClawBench-Lite — a curated 20-task subset of ClawBench. The manifest lists selected task_ids without duplicating task data; each entry references a test-cases/<dir>/task.json that must exist.",
  "type": "object",
  "properties": {
    "$schema": true,
    "version": {
      "type": "string",
      "description": "Semantic version of the Lite selection (e.g., \"0.1\"). Bump when tasks are added, removed, or re-scored."
    },
    "created": {
      "type": "string",
      "format": "date",
      "description": "ISO date (YYYY-MM-DD) when this version of the manifest was locked."
    },
    "rubric_max": {
      "type": "integer",
      "description": "Maximum possible rubric total. For v0.1 this is 12 (4 axes × 3 points each).",
      "const": 12
    },
    "total_tasks": {
      "type": "integer",
      "description": "Number of tasks in the Lite subset. Must equal the length of the tasks array.",
      "minimum": 1
    },
    "notes": {
      "type": "string",
      "description": "Free-text rationale and provenance notes for this Lite version."
    },
    "skipped_categories": {
      "type": "array",
      "description": "Metaclasses intentionally excluded from Lite v0.1. Documented here so the omission reads as a curatorial choice, not an oversight.",
      "items": {
        "type": "string"
      }
    },
    "tier_distribution": {
      "type": "object",
      "description": "Per-tier slot allocation — flagship/core/wildcard, summing to total_tasks.",
      "properties": {
        "flagship": { "type": "integer", "minimum": 0 },
        "core": { "type": "integer", "minimum": 0 },
        "wildcard": { "type": "integer", "minimum": 0 }
      },
      "required": ["flagship", "core", "wildcard"],
      "additionalProperties": false
    },
    "tasks": {
      "type": "array",
      "description": "Selected tasks. Each entry references a task.json under test-cases/ and records its score and rationale.",
      "items": {
        "type": "object",
        "properties": {
          "task_id": {
            "type": "integer",
            "description": "Matches metadata.task_id in the referenced task.json"
          },
          "dir": {
            "type": "string",
            "description": "Directory name under test-cases/ (e.g., \"179-dev-tech-github-ops-github\")"
          },
          "tier": {
            "type": "string",
            "enum": ["flagship", "core", "wildcard"],
            "description": "Which tier this task fills"
          },
          "metaclass": {
            "type": "string",
            "description": "Matches metadata.metaclass in the referenced task.json"
          },
          "platform": {
            "type": "string",
            "description": "Short site/brand identifier (e.g., \"github\", \"airbnb\", \"1password\")"
          },
          "url_pattern_concrete": {
            "type": "boolean",
            "description": "True if eval_schema.url_pattern is a real regex (machine-scorable); false if it is __PLACEHOLDER_WILL_NOT_MATCH__ (agentic-scoring only). Both are allowed in Lite v0.1 because eval is fully agentic."
          },
          "scores": {
            "type": "object",
            "properties": {
              "popularity": { "type": "integer", "minimum": 0, "maximum": 3 },
              "realism": { "type": "integer", "minimum": 0, "maximum": 3 },
              "difficulty": { "type": "integer", "minimum": 0, "maximum": 3 },
              "ambassador": { "type": "integer", "minimum": 0, "maximum": 3 },
              "total": { "type": "integer", "minimum": 0, "maximum": 12 }
            },
            "required": ["popularity", "realism", "difficulty", "ambassador", "total"],
            "additionalProperties": false
          },
          "rationale": {
            "type": "string",
            "description": "One-sentence justification for inclusion."
          }
        },
        "required": ["task_id", "dir", "tier", "metaclass", "platform", "url_pattern_concrete", "scores", "rationale"],
        "additionalProperties": false
      }
    }
  },
  "required": ["version", "created", "rubric_max", "total_tasks", "notes", "skipped_categories", "tier_distribution", "tasks"],
  "additionalProperties": false
}
